{
    "title": "generic-spells",
    "description": "A collection of simple spells for the powerd6 system.",
    "source": "https://github.com/sample-user/generic-spells",
    "types": {
        "spell": {
            "description": "Arcane or mystical arts that can be used inside or outside combat.",
            "schema": {
                "properties": {
                    "name": {
                        "description": "The name of the spell.",
                        "type": "string"
                    },
                    "recovery": {
                        "description": "How many turns must be passed before using the spell again.",
                        "type": "number"
                    },
                    "effect": {
                        "description": "The effect that is executed when the spell is used.",
                        "type": "string"
                    }
                },
                "required": [
                    "name",
                    "recovery",
                    "effect"
                ]
            },
            "rendering": {
                "txt": "${name}:\n(Recovery ${recovery})\n${effect}",
                "md": "# ${name}\n> Recovery ${recovery}\n\n${effect}"
            }
        }
    },
    "content": {
        "fireball": {
            "type": "spell",
            "name": "Fireball",
            "recovery": 2,
            "effect": "Create an orb of flames that can be thrown with magical energy."
        }
    }
}